{
  "event_id": "e4eebc99-9c0b-4ef8-bb6d-6bb9bd380a55",
  "event_type": "order.shipped",
  "event_version": 1,
  "occurred_at": "2026-09-01T16:35:00.000Z",
  "producer": "worker",
  "business_key": {
    "order_number": "OR-1001"
  },
  "payload": {
    "order_id": "ord_12345",
    "order_number": "OR-1001",
    "carrier": "Correios",
    "tracking_code": "QB123456789BR",
    "tracking_url": "https://rastreamento.correios.com.br/app/index.php?codigo=QB123456789BR",
    "items": [
      {
        "sku": "ROBO-LED-01",
        "qty": 1
      }
    ],
    "shipped_at": "2026-09-01T16:35:00.000Z"
  }
}
